[
  {
    "id": "n-temoin-maths-alpha",
    "chapitre": "temoin-maths",
    "titre": "Notion d'essai incontournable",
    "resume": "Résumé d'essai : ce que la première notion apprend à faire.",
    "ordre": 10,
    "priorite": 3,
    "priorisation": "estimation",
    "pourquoi": "Estimation d'essai : la notion la plus importante du témoin.",
    "capacites": [
      "bo-m-temoin-01",
      "bo-m-temoin-02"
    ],
    "prerequis": [
      "1e:suites"
    ],
    "attendusBac": [
      "Formulation d'essai relevée dans un sujet (témoin)."
    ]
  },
  {
    "id": "n-temoin-maths-beta",
    "chapitre": "temoin-maths",
    "titre": "Notion d'essai fréquente",
    "resume": "Résumé d'essai de la deuxième notion, avec $x^2$.",
    "ordre": 20,
    "priorite": 2,
    "priorisation": "estimation",
    "pourquoi": "Estimation d'essai : utile à la notion suivante.",
    "capacites": [
      "bo-m-temoin-03",
      "bo-m-temoin-04"
    ],
    "prerequis": [
      "n-temoin-maths-alpha"
    ],
    "attendusBac": []
  },
  {
    "id": "n-temoin-maths-gamma",
    "chapitre": "temoin-maths",
    "titre": "Notion d'essai plus rare",
    "resume": "Résumé d'essai de la troisième notion.",
    "ordre": 30,
    "priorite": 1,
    "priorisation": "estimation",
    "pourquoi": "Estimation d'essai : rarement demandée.",
    "capacites": [
      "bo-m-temoin-05",
      "bo-m-temoin-06"
    ],
    "prerequis": [
      "n-temoin-maths-beta",
      "n-temoin-methodes-maths-logique"
    ],
    "attendusBac": []
  }
]
