[
  {
    "id": "n-vecteurs-espace-combinaisons",
    "chapitre": "vecteurs-espace",
    "titre": "Vecteurs de l'espace, combinaisons linéaires",
    "resume": "Calculer avec les vecteurs de l'espace comme dans le plan (relation de Chasles, sommes, multiples) et écrire un vecteur à partir d'autres sur une figure.",
    "ordre": 10,
    "priorite": 1,
    "priorisation": "annales",
    "pourquoi": "Tombé dans 14 sujets sur 103 depuis 2021.",
    "capacites": [
      "bo-m-vecteurs-01",
      "bo-m-vecteurs-02",
      "bo-m-vecteurs-08",
      "bo-m-vecteurs-09",
      "bo-m-vecteurs-14",
      "bo-m-vecteurs-15"
    ],
    "prerequis": [],
    "attendusBac": [
      "Démontrer que le quadrilatère FJLK est un parallélogramme."
    ]
  },
  {
    "id": "n-vecteurs-espace-droites",
    "chapitre": "vecteurs-espace",
    "titre": "Droites de l'espace, vecteurs colinéaires",
    "resume": "Reconnaître des vecteurs colinéaires et s'en servir : droite donnée par un point et un vecteur directeur, points alignés, droites parallèles.",
    "ordre": 20,
    "priorite": 2,
    "priorisation": "annales",
    "pourquoi": "Tombé dans 50 sujets sur 103 depuis 2021.",
    "capacites": [
      "bo-m-vecteurs-03",
      "bo-m-vecteurs-04"
    ],
    "prerequis": [
      "n-vecteurs-espace-combinaisons",
      "1e:geometrie-reperee"
    ],
    "attendusBac": [
      "Démontrer que les points A, B et C ne sont pas alignés.",
      "Les droites (AI) et (KH) sont-elles parallèles ? Justifier votre réponse."
    ]
  },
  {
    "id": "n-vecteurs-espace-plans",
    "chapitre": "vecteurs-espace",
    "titre": "Plans de l'espace, vecteurs coplanaires",
    "resume": "Décrire un plan par un point et deux vecteurs non colinéaires, montrer que trois points définissent un plan et reconnaître des vecteurs coplanaires.",
    "ordre": 30,
    "priorite": 1,
    "priorisation": "annales",
    "pourquoi": "Tombé dans 11 sujets sur 103 depuis 2021.",
    "capacites": [
      "bo-m-vecteurs-05",
      "bo-m-vecteurs-06"
    ],
    "prerequis": [
      "n-vecteurs-espace-combinaisons",
      "n-vecteurs-espace-droites"
    ],
    "attendusBac": [
      "Montrer que les points A, B et C définissent un plan.",
      "Montrer qu'il existe des réels $\\alpha$ et $\\beta$ tels que $\\overrightarrow{\\text{BH}} = \\alpha \\overrightarrow{\\text{BC}} + \\beta \\overrightarrow{\\text{BD}}$."
    ]
  },
  {
    "id": "n-vecteurs-espace-positions-relatives",
    "chapitre": "vecteurs-espace",
    "titre": "Positions relatives de droites et de plans",
    "resume": "Dire si deux droites sont sécantes, parallèles ou non coplanaires, si une droite coupe un plan, et si deux plans se coupent ou sont parallèles.",
    "ordre": 40,
    "priorite": 2,
    "priorisation": "annales",
    "pourquoi": "Tombé dans 49 sujets sur 103 depuis 2021.",
    "capacites": [
      "bo-m-vecteurs-10"
    ],
    "prerequis": [
      "n-vecteurs-espace-droites",
      "n-vecteurs-espace-plans"
    ],
    "attendusBac": [
      "Les droites $\\mathcal{D}$ et $\\mathcal{D}'$ sont : a. sécantes b. strictement parallèles c. non coplanaires d. confondues",
      "Déterminer la position relative des droites (PQ) et $\\Delta$.",
      "La droite $d$ et le plan (ABC) sont-ils sécants ou parallèles ?"
    ]
  },
  {
    "id": "n-vecteurs-espace-bases-reperes",
    "chapitre": "vecteurs-espace",
    "titre": "Bases, repères et coordonnées",
    "resume": "Reconnaître trois vecteurs qui forment une base, décomposer un vecteur sur cette base et lire les coordonnées d'un point ou d'un vecteur dans un repère.",
    "ordre": 50,
    "priorite": 2,
    "priorisation": "annales",
    "pourquoi": "Tombé dans 34 sujets sur 103 depuis 2021.",
    "capacites": [
      "bo-m-vecteurs-07",
      "bo-m-vecteurs-11",
      "bo-m-vecteurs-12"
    ],
    "prerequis": [
      "n-vecteurs-espace-plans",
      "1e:geometrie-reperee"
    ],
    "attendusBac": [
      "Montrer que les vecteurs $\\overrightarrow{BE}$, $\\overrightarrow{BC}$ et $\\overrightarrow{AG}$ ne sont pas coplanaires."
    ]
  },
  {
    "id": "n-vecteurs-espace-configurations",
    "chapitre": "vecteurs-espace",
    "titre": "Démontrer un alignement, un parallélisme, une coplanarité",
    "resume": "Choisir les bons vecteurs, les écrire sur une base ou en coordonnées, puis conclure : alignement, parallélisme, points coplanaires ou non.",
    "ordre": 60,
    "priorite": 2,
    "priorisation": "annales",
    "pourquoi": "Tombé dans 32 sujets sur 103 depuis 2021.",
    "capacites": [
      "bo-m-vecteurs-13"
    ],
    "prerequis": [
      "n-vecteurs-espace-positions-relatives",
      "n-vecteurs-espace-bases-reperes"
    ],
    "attendusBac": [
      "Montrer que les points A, B, C et D sont coplanaires.",
      "Montrer que les vecteurs $\\overrightarrow{\\text{IJ}}$, $\\overrightarrow{\\text{AE}}$ et $\\overrightarrow{\\text{AC}}$ sont coplanaires.",
      "Démontrer que les points A, B, C et D ne sont pas coplanaires."
    ]
  }
]
