[
  {
    "id": "n-limites-suites-definitions",
    "chapitre": "limites-suites",
    "titre": "Limite finie ou infinie d'une suite",
    "resume": "Dire ce que signifie « $u_n$ tend vers $+\\infty$ » ou « $u_n$ converge vers $\\ell$ », et connaître les limites de $n^2$, $\\sqrt{n}$ et $\\frac{1}{n}$.",
    "ordre": 10,
    "priorite": 2,
    "priorisation": "annales",
    "pourquoi": "Tombé dans 10 sujets sur 103 depuis 2021 ; monte d'un cran car il faut savoir ce que « converger » veut dire pour justifier qu'une suite converge.",
    "capacites": [
      "bo-m-suites-01",
      "bo-m-suites-02",
      "bo-m-suites-10"
    ],
    "prerequis": [
      "n-recurrence-suites-encadrement-variation",
      "1e:suites"
    ],
    "attendusBac": [
      "Soit $p \\in \\mathbb{N}^*$. Pourquoi peut-on affirmer qu'il existe au moins un entier $n_0$ tel que, pour tout entier naturel $n$ vérifiant, $n \\geqslant n_0$, $u_n \\geqslant 10^p$ ?"
    ]
  },
  {
    "id": "n-limites-suites-operations",
    "chapitre": "limites-suites",
    "titre": "Opérations sur les limites, formes indéterminées",
    "resume": "Calculer la limite d'une somme, d'un produit ou d'un quotient, et lever une forme indéterminée comme $\\frac{3n}{n+2}$ en factorisant.",
    "ordre": 20,
    "priorite": 2,
    "priorisation": "annales",
    "pourquoi": "Tombé dans 35 sujets sur 103 depuis 2021.",
    "capacites": [
      "bo-m-suites-04"
    ],
    "prerequis": [
      "n-limites-suites-definitions"
    ],
    "attendusBac": [
      "On considère la suite $\\left(v_n\\right)$ définie sur $\\mathbb{N}$ par $v_n = \\dfrac{3n}{n + 2}$. On cherche à déterminer la limite de $v_n$ lorsque $n$ tend vers $+\\infty$.",
      "Déterminer, pour tout entier naturel $n$, l'expression de $u_n$ en fonction de $n$. En déduire la limite de la suite $\\left(u_n\\right)$."
    ]
  },
  {
    "id": "n-limites-suites-comparaison",
    "chapitre": "limites-suites",
    "titre": "Comparaison et théorème des gendarmes",
    "resume": "Trouver une limite en coinçant la suite : au-dessus d'une suite qui tend vers $+\\infty$, ou entre deux suites qui ont la même limite (gendarmes).",
    "ordre": 30,
    "priorite": 2,
    "priorisation": "annales",
    "pourquoi": "Tombé dans 26 sujets sur 103 depuis 2021.",
    "capacites": [
      "bo-m-suites-03",
      "bo-m-suites-12"
    ],
    "prerequis": [
      "n-limites-suites-definitions",
      "n-recurrence-suites-encadrement-variation"
    ],
    "attendusBac": [
      "Démontrer que : $\\displaystyle\\lim_{n \\to +\\infty} \\dfrac{u_n}{n} = 1$.",
      "On considère trois suites $\\left(u_n\\right)$, $\\left(v_n\\right)$ et $\\left(w_n\\right)$. On sait que, pour tout entier naturel $n$, on a : $u_n \\leqslant v_n \\leqslant w_n$ et de plus: $\\displaystyle\\lim_{n \\to + \\infty} u_n= 1$ et $\\displaystyle\\lim_{n \\to + \\infty} w_n= 3$. On peut alors affirmer que :",
      "Une suite $(u_n)$ est minorée par 3 et converge vers un réel $\\ell$. On peut affirmer que :"
    ]
  },
  {
    "id": "n-limites-suites-geometrique",
    "chapitre": "limites-suites",
    "titre": "Limite d'une suite géométrique",
    "resume": "Savoir vers quoi tend $q^n$ selon $q$, puis trouver la limite d'une suite comme $u_n = 2 \\times 0{,}9^n - 3$, souvent grâce à une suite auxiliaire.",
    "ordre": 40,
    "priorite": 2,
    "priorisation": "annales",
    "pourquoi": "Tombé dans 46 sujets sur 103 depuis 2021.",
    "capacites": [
      "bo-m-suites-05",
      "bo-m-suites-11"
    ],
    "prerequis": [
      "n-limites-suites-operations",
      "n-limites-suites-comparaison",
      "n-recurrence-suites-recurrence",
      "n-recurrence-suites-modelisation",
      "1e:suites"
    ],
    "attendusBac": [
      "On considère la suite $\\left(a_n\\right)$ définie pour tout $n$ dans $\\mathbb{N}$ par : $a_n = \\dfrac{1 - 3^n}{1 + 2^n}$. La limite de la suite $\\left(a_n\\right)$ est égale à :",
      "Déterminer l'expression de $x_{n}$ en fonction de $n$. En déduire la limite de la suite $(x_{n})$.",
      "Déterminer la limite de la suite $(p_n)$ et interpréter le résultat dans le contexte de l'exercice."
    ]
  },
  {
    "id": "n-limites-suites-monotone-bornee",
    "chapitre": "limites-suites",
    "titre": "Suite croissante majorée, décroissante minorée",
    "resume": "Prouver qu'une suite a une limite finie sans la calculer, en montrant qu'elle monte sans dépasser un plafond ou descend sans passer sous un plancher.",
    "ordre": 50,
    "priorite": 3,
    "priorisation": "annales",
    "pourquoi": "Tombé dans 95 sujets sur 103 depuis 2021.",
    "capacites": [
      "bo-m-suites-06",
      "bo-m-suites-07",
      "bo-m-suites-16"
    ],
    "prerequis": [
      "n-limites-suites-definitions",
      "n-recurrence-suites-encadrement-variation"
    ],
    "attendusBac": [
      "Justifier que la suite $(u_n)$ converge.",
      "La suite $\\left(u_n\\right)$ est-elle convergente ? Justifier la réponse.",
      "En déduire que la suite $\\left(u_n\\right)$ converge. Il n'est pas demandé, ici, de calculer sa limite."
    ]
  },
  {
    "id": "n-limites-suites-seuils",
    "chapitre": "limites-suites",
    "titre": "Seuils et valeurs approchées en Python",
    "resume": "Écrire en Python une boucle qui trouve le premier rang où une suite dépasse un seuil, et approcher un nombre comme $\\sqrt{2}$ par une suite.",
    "ordre": 60,
    "priorite": 2,
    "priorisation": "annales",
    "pourquoi": "Tombé dans 49 sujets sur 103 depuis 2021.",
    "capacites": [
      "bo-m-suites-14",
      "bo-m-suites-15",
      "bo-m-suites-18"
    ],
    "prerequis": [
      "n-limites-suites-definitions",
      "n-recurrence-suites-modelisation"
    ],
    "attendusBac": [
      "Écrire un programme qui permet de déterminer en quelle année le nombre d'abonnés dépassera $2\\,200$.",
      "Expliquer pourquoi, pour tout entier naturel non nul p, la boucle while ne tourne pas indéfiniment, ce qui permet à la commande algo (p) de renvoyer une valeur.",
      "La valeur renvoyée par seuil(4) est 9. Interpréter cette valeur dans le contexte de l'exercice."
    ]
  }
]
