[
  {
    "id": "n-continuite-fonction-continue",
    "chapitre": "continuite",
    "titre": "Fonction continue",
    "resume": "Reconnaître une fonction continue (sa courbe se trace sans lever le crayon) et savoir qu'une fonction dérivable l'est toujours.",
    "ordre": 10,
    "priorite": 2,
    "priorisation": "annales",
    "pourquoi": "Tombé dans 0 sujet sur 103 depuis 2021 ; monte d'un cran car le théorème des valeurs intermédiaires et la limite d'une suite uₙ₊₁ = f(uₙ) en dépendent.",
    "capacites": [
      "bo-m-continuite-01",
      "bo-m-continuite-10"
    ],
    "prerequis": [
      "n-limites-fonctions-definitions",
      "1e:derivation"
    ],
    "attendusBac": []
  },
  {
    "id": "n-continuite-valeurs-intermediaires",
    "chapitre": "continuite",
    "titre": "Théorème des valeurs intermédiaires",
    "resume": "À partir du tableau de variations, prouver qu'une équation $f(x) = k$ a une solution et une seule, compter ses solutions selon $k$ et les encadrer.",
    "ordre": 20,
    "priorite": 3,
    "priorisation": "annales",
    "pourquoi": "Tombé dans 75 sujets sur 103 depuis 2021.",
    "capacites": [
      "bo-m-continuite-03",
      "bo-m-continuite-04"
    ],
    "prerequis": [
      "n-continuite-fonction-continue",
      "n-limites-fonctions-croissances-comparees",
      "1e:derivation"
    ],
    "attendusBac": [
      "Montrer que l'équation $f(x)=0$ admet une unique solution $\\alpha$ sur $]-2\\,;\\,+\\infty[$ et donner une valeur arrondie de $\\alpha$ à $10^{-2}$ près.",
      "Montrer que l'équation $h(x) = 0$ admet une solution unique $\\alpha$ appartenant à $]0\\,;\\,+\\infty[$ et vérifier que : $\\dfrac{1}{2} < \\alpha < 1$.",
      "Soit $m$ un nombre réel. Préciser, en fonction des valeurs du nombre réel $m$, le nombre de solutions de l'équation $f(x) = m$."
    ]
  },
  {
    "id": "n-continuite-approcher-solution",
    "chapitre": "continuite",
    "titre": "Approcher une solution : dichotomie, Newton, sécante",
    "resume": "Approcher la solution d'une équation par un algorithme en Python : dichotomie (couper l'intervalle en deux), méthode de Newton ou de la sécante.",
    "ordre": 30,
    "priorite": 1,
    "priorisation": "annales",
    "pourquoi": "Tombé dans 3 sujets sur 103 depuis 2021.",
    "capacites": [
      "bo-m-continuite-06",
      "bo-m-continuite-07",
      "bo-m-continuite-08"
    ],
    "prerequis": [
      "n-continuite-valeurs-intermediaires",
      "n-limites-suites-seuils",
      "1e:derivation"
    ],
    "attendusBac": []
  },
  {
    "id": "n-continuite-suite-recurrente",
    "chapitre": "continuite",
    "titre": "Limite d'une suite uₙ₊₁ = f(uₙ)",
    "resume": "Étudier une suite $u_{n+1} = f(u_n)$ jusqu'au bout : montrer qu'elle converge, puis trouver sa limite $\\ell$ en résolvant $f(\\ell) = \\ell$.",
    "ordre": 40,
    "priorite": 3,
    "priorisation": "annales",
    "pourquoi": "Tombé dans 55 sujets sur 103 depuis 2021.",
    "capacites": [
      "bo-m-continuite-02",
      "bo-m-continuite-05",
      "bo-m-continuite-09"
    ],
    "prerequis": [
      "n-continuite-fonction-continue",
      "n-recurrence-suites-encadrement-variation",
      "n-limites-suites-monotone-bornee",
      "1e:second-degre"
    ],
    "attendusBac": [
      "Justifier que la limite $\\ell$ vérifie $f(\\ell) = \\ell$ puis en déduire la valeur de $\\ell$.",
      "On appelle $L$ la limite de la suite $\\left(p_n\\right)$. Justifier que $L$ est solution de l'équation $0{,}7x^2 - x + 0{,}3 = 0$",
      "On note $\\ell$ la limite de la suite $(u_n)$. Déterminer la valeur de $\\ell$."
    ]
  }
]
