[
  {
    "id": "n-limites-fonctions-definitions",
    "chapitre": "limites-fonctions",
    "titre": "Limite en l'infini, en un réel ; asymptotes",
    "resume": "Comprendre « $f(x)$ tend vers $\\ell$ » ou « vers $+\\infty$ » quand $x$ tend vers l'infini ou vers un réel, et repérer les asymptotes de la courbe.",
    "ordre": 10,
    "priorite": 2,
    "priorisation": "annales",
    "pourquoi": "Tombé dans 31 sujets sur 103 depuis 2021.",
    "capacites": [
      "bo-m-limites-fonctions-01",
      "bo-m-limites-fonctions-06",
      "bo-m-limites-fonctions-08"
    ],
    "prerequis": [
      "n-limites-suites-definitions"
    ],
    "attendusBac": [
      "Justifier que la droite d'équation $y=1$ est asymptote à la courbe représentative de la fonction $f$.",
      "Déterminer la limite de la fonction $f$ en $+ \\infty$. Interpréter graphiquement ce résultat.",
      "Justifier que l'axe des ordonnées est asymptote à la courbe $\\mathcal{C}_f$."
    ]
  },
  {
    "id": "n-limites-fonctions-reference",
    "chapitre": "limites-fonctions",
    "titre": "Limites des fonctions de référence",
    "resume": "Connaître les limites de $x^n$, $\\frac{1}{x^n}$, $\\sqrt{x}$ et $e^x$ en l'infini et en $0$, et démontrer que $e^x$ tend vers $+\\infty$ en $+\\infty$.",
    "ordre": 20,
    "priorite": 3,
    "priorisation": "annales",
    "pourquoi": "Tombé dans 57 sujets sur 103 depuis 2021.",
    "capacites": [
      "bo-m-limites-fonctions-02",
      "bo-m-suites-13"
    ],
    "prerequis": [
      "n-limites-fonctions-definitions",
      "n-limites-suites-geometrique",
      "1e:exponentielle"
    ],
    "attendusBac": [
      "On considère la fonction $f$ définie sur $\\mathbb{R}$ par $f(x) = \\dfrac{3}{5 + \\text{e}^x}$. Sa courbe représentative dans un repère admet :"
    ]
  },
  {
    "id": "n-limites-fonctions-operations",
    "chapitre": "limites-fonctions",
    "titre": "Opérations, composée, formes indéterminées",
    "resume": "Calculer la limite d'une somme, d'un produit, d'un quotient ou d'une composée ($e^{-x}$), et lever une indéterminée en factorisant le terme le plus fort.",
    "ordre": 30,
    "priorite": 2,
    "priorisation": "annales",
    "pourquoi": "Tombé dans 43 sujets sur 103 depuis 2021.",
    "capacites": [
      "bo-m-limites-fonctions-04"
    ],
    "prerequis": [
      "n-limites-fonctions-reference",
      "n-limites-suites-operations"
    ],
    "attendusBac": [
      "Que vaut : $\\displaystyle\\lim_{x \\to + \\infty} \\dfrac{\\text{e}^x + 1}{\\text{e}^x - 1}$",
      "On considère la fonction $g$ définie sur $[0\\,;\\,+\\infty[$ par $g(t) = \\dfrac{a}{b + \\text{e}^{-t}}$ où $a$ et $b$ sont deux nombres réels. On sait que $g(0) = 2$ et $\\displaystyle\\lim_{t \\to +\\infty} g(t) = 3$. Les valeurs de $a$ et $b$ sont :"
    ]
  },
  {
    "id": "n-limites-fonctions-comparaison",
    "chapitre": "limites-fonctions",
    "titre": "Comparaison et encadrement",
    "resume": "Trouver une limite en coinçant la fonction : au-dessus d'une fonction qui tend vers $+\\infty$, ou entre deux fonctions qui ont la même limite.",
    "ordre": 40,
    "priorite": 2,
    "priorisation": "annales",
    "pourquoi": "Tombé dans 1 sujet sur 103 depuis 2021 ; monte d'un cran car c'est l'outil qui démontre les croissances comparées.",
    "capacites": [
      "bo-m-limites-fonctions-03"
    ],
    "prerequis": [
      "n-limites-fonctions-operations",
      "n-limites-suites-comparaison"
    ],
    "attendusBac": []
  },
  {
    "id": "n-limites-fonctions-croissances-comparees",
    "chapitre": "limites-fonctions",
    "titre": "Croissances comparées, choisir sa méthode",
    "resume": "Savoir que $e^x$ grandit plus vite que toute puissance de $x$ (ainsi $x^2 e^{-x}$ tend vers $0$) et choisir la bonne méthode face à une limite.",
    "ordre": 50,
    "priorite": 3,
    "priorisation": "annales",
    "pourquoi": "Tombé dans 83 sujets sur 103 depuis 2021.",
    "capacites": [
      "bo-m-limites-fonctions-05",
      "bo-m-limites-fonctions-07"
    ],
    "prerequis": [
      "n-limites-fonctions-operations",
      "n-limites-fonctions-comparaison",
      "1e:derivation"
    ],
    "attendusBac": [
      "On considère la fonction $f$ définie sur l'ensemble des nombres réels $\\mathbb{R}$ par : $f(x) = (x^2 - 4)\\text{e}^{-x}$. Déterminer les limites de la fonction $f$ en $-\\infty$ et en $+\\infty$.",
      "En remarquant que pour tout $x$ dans $[0\\,;\\,+\\infty[$, on a $f(x) = \\dfrac{x}{\\text{e}^x}$, démontrer que la courbe $\\mathcal{C}_f$ possède une asymptote en $+\\infty$ dont on donnera une équation.",
      "Démontrer que, pour tout réel $x$ non nul, $f(x) = 1+ 0{,}5x\\left(2 - \\dfrac{\\text{e}^{0{,}5x}}{0{,}5x} \\times \\text{e}^{-2}\\right)$. En déduire la limite de la fonction $f$ en $+\\infty$."
    ]
  }
]
