[
  {
    "id": "n-recurrence-suites-recurrence",
    "chapitre": "recurrence-suites",
    "titre": "Le raisonnement par récurrence",
    "resume": "Prouver qu'une propriété est vraie pour tout entier $n$ en deux temps : la vérifier au départ, puis montrer qu'elle se transmet d'un entier au suivant.",
    "ordre": 10,
    "priorite": 3,
    "priorisation": "annales",
    "pourquoi": "Tombé dans 91 sujets sur 103 depuis 2021.",
    "capacites": [
      "bo-m-logique-14"
    ],
    "prerequis": [
      "1e:suites"
    ],
    "attendusBac": [
      "Démontrer par récurrence que, pour tout $n \\in \\mathbb{N}$, $u_n = 2 \\times 0{,}9^n - 3$.",
      "Démontrer par récurrence que pour tout entier $n \\geqslant 1$ : $S_n = \\dfrac{n(n + 1)(2n + 1)}{6}$.",
      "Conjecturer l'expression de $u_{n}$ en fonction de $n$ et démontrer cette conjecture."
    ]
  },
  {
    "id": "n-recurrence-suites-encadrement-variation",
    "chapitre": "recurrence-suites",
    "titre": "Encadrement et sens de variation par récurrence",
    "resume": "Prouver par récurrence qu'une suite reste entre deux valeurs et qu'elle est croissante ou décroissante, en particulier quand $u_{n+1} = f(u_n)$.",
    "ordre": 20,
    "priorite": 3,
    "priorisation": "annales",
    "pourquoi": "Tombé dans 91 sujets sur 103 depuis 2021.",
    "capacites": [
      "bo-m-suites-08"
    ],
    "prerequis": [
      "n-recurrence-suites-recurrence",
      "1e:suites",
      "1e:derivation"
    ],
    "attendusBac": [
      "Démontrer par récurrence que, pour tout entier naturel $n$, on a : $u_n > 0$.",
      "En remarquant que, pour tout entier naturel $n$, $u_{n+1} = f\\left(u_n\\right)$ démontrer par récurrence que, pour tout entier naturel $n$ : $0 \\leqslant u_n \\leqslant u_{n+1} \\leqslant 100$.",
      "On considère la suite $(u_n)$ définie par $u_0 = 3$ et pour tout $n \\in \\mathbb{N}$ : $u_{n+1} = \\dfrac{4}{5 - u_n}$. Démontrer par récurrence que pour tout entier naturel $n$ on a : $1 \\leqslant u_{n+1} \\leqslant u_n \\leqslant 4$."
    ]
  },
  {
    "id": "n-recurrence-suites-modelisation",
    "chapitre": "recurrence-suites",
    "titre": "Modéliser une évolution par une suite",
    "resume": "Traduire une évolution étape par étape (population, abonnés, médicament) par une suite comme $u_{n+1} = 0{,}9u_n + 50$, puis interpréter ses termes.",
    "ordre": 30,
    "priorite": 2,
    "priorisation": "annales",
    "pourquoi": "Tombé dans 44 sujets sur 103 depuis 2021.",
    "capacites": [
      "bo-m-suites-09",
      "bo-m-suites-17"
    ],
    "prerequis": [
      "n-recurrence-suites-recurrence",
      "1e:suites",
      "1e:probas-cond"
    ],
    "attendusBac": [
      "Justifier en vous aidant de l'arbre que, pour tout entier naturel $n$, on a : $p_{n+1} = 0{,}6p_n + 0{,}3$.",
      "Montrer que, pour tout entier naturel $n$ non nul, $p_{n+1} = 0{,}2p_n + 0{,}6$.",
      "Justifier que pour tout entier naturel $n$ non nul, $g_{n+1} = 0{,}5g_n + 0{,}2$."
    ]
  }
]
