[
  {
    "id": "n-equations-espace-representation-parametrique",
    "chapitre": "equations-espace",
    "titre": "Représentation paramétrique d'une droite",
    "resume": "Décrire une droite par trois égalités en fonction d'un réel $t$, y lire un point et un vecteur directeur, et tester si un point est sur la droite.",
    "ordre": 10,
    "priorite": 3,
    "priorisation": "annales",
    "pourquoi": "Tombé dans 101 sujets sur 103 depuis 2021.",
    "capacites": [
      "bo-m-representations-01",
      "bo-m-representations-03"
    ],
    "prerequis": [
      "n-vecteurs-espace-droites",
      "n-vecteurs-espace-bases-reperes",
      "1e:geometrie-reperee"
    ],
    "attendusBac": [
      "Déterminer une représentation paramétrique de la droite (BC).",
      "Déterminer une représentation paramétrique de la droite $\\mathcal{D}$ orthogonale au plan ABC et passant par le point E.",
      "Justifier qu'une représentation paramétrique de la droite (OH) est : $\\begin{cases} x =0\\\\ y =2t\\\\ z =t \\end{cases}$ avec $t \\in \\mathbb{R}$."
    ]
  },
  {
    "id": "n-equations-espace-equation-plan",
    "chapitre": "equations-espace",
    "titre": "Équation cartésienne d'un plan",
    "resume": "Écrire l'équation $ax + by + cz + d = 0$ d'un plan à partir d'un point et d'un vecteur normal, lire un vecteur normal sur une équation, tester un point.",
    "ordre": 20,
    "priorite": 3,
    "priorisation": "annales",
    "pourquoi": "Tombé dans 94 sujets sur 103 depuis 2021.",
    "capacites": [
      "bo-m-representations-02",
      "bo-m-representations-04",
      "bo-m-representations-07",
      "bo-m-representations-09"
    ],
    "prerequis": [
      "n-orthogonalite-espace-vecteur-normal",
      "n-orthogonalite-espace-repere-orthonorme",
      "1e:geometrie-reperee"
    ],
    "attendusBac": [
      "Le vecteur $\\overrightarrow{n}$ de coordonnées $(2~;~0~;~-3)$ est vecteur normal au plan (EHI). Déterminer une équation cartésienne du plan (EHI).",
      "Déterminer une équation du plan $\\mathcal{P}$ passant par le point C et perpendiculaire à la droite (AB).",
      "Vérifier qu'une équation cartésienne du plan (BDG) est $x + y - z - 1 = 0$."
    ]
  },
  {
    "id": "n-equations-espace-projete",
    "chapitre": "equations-espace",
    "titre": "Coordonnées d'un projeté orthogonal",
    "resume": "Calculer les coordonnées du projeté orthogonal d'un point sur un plan donné par une équation, ou sur une droite, puis en déduire une distance.",
    "ordre": 30,
    "priorite": 3,
    "priorisation": "annales",
    "pourquoi": "Tombé dans 59 sujets sur 103 depuis 2021.",
    "capacites": [
      "bo-m-representations-05"
    ],
    "prerequis": [
      "n-equations-espace-representation-parametrique",
      "n-equations-espace-equation-plan",
      "n-orthogonalite-espace-projete-distance"
    ],
    "attendusBac": [
      "Déterminer les coordonnées du projeté orthogonal H du point D sur le plan (ABC).",
      "On note $\\Delta$ la droite passant par le point G et orthogonale au plan (CFK). Soit L le point d'intersection entre la droite $\\Delta$ et le plan (CFK). Déterminer les coordonnées du point L.",
      "Déterminer les coordonnées du point M de la droite $d_2$ pour lesquelles la distance AM est minimale."
    ]
  },
  {
    "id": "n-equations-espace-intersections",
    "chapitre": "equations-espace",
    "titre": "Intersections et positions relatives par le calcul",
    "resume": "Traduire une question (droites sécantes, droite et plan, deux plans, points coplanaires, base) par un système d'équations, le résoudre et conclure.",
    "ordre": 40,
    "priorite": 3,
    "priorisation": "annales",
    "pourquoi": "Tombé dans 73 sujets sur 103 depuis 2021.",
    "capacites": [
      "bo-m-representations-06",
      "bo-m-representations-08",
      "bo-m-representations-10",
      "bo-m-representations-11"
    ],
    "prerequis": [
      "n-equations-espace-representation-parametrique",
      "n-equations-espace-equation-plan",
      "n-equations-espace-projete",
      "n-vecteurs-espace-positions-relatives",
      "n-vecteurs-espace-configurations"
    ],
    "attendusBac": [
      "Démontrer que les droites $\\mathcal{D}_1$ et $\\mathcal{D}_2$ sont sécantes et déterminer les coordonnées de leur point d'intersection.",
      "Déterminer l'intersection de la droite (EL) et du plan (AGH).",
      "Justifier que les plans $\\mathcal{P}_1$ et $\\mathcal{P}_2$ sont sécants."
    ]
  }
]
