[
  {
    "id": "n-orthogonalite-espace-produit-scalaire",
    "chapitre": "orthogonalite-espace",
    "titre": "Produit scalaire dans l'espace",
    "resume": "Calculer un produit scalaire dans l'espace comme dans le plan : mêmes formules, mêmes règles de calcul, et son lien avec les longueurs.",
    "ordre": 10,
    "priorite": 2,
    "priorisation": "annales",
    "pourquoi": "Tombé dans 10 sujets sur 103 depuis 2021 ; sa priorité monte d'un cran car l'orthogonalité, les coordonnées et les distances du chapitre reposent sur le produit scalaire.",
    "capacites": [
      "bo-m-orthogonalite-01",
      "bo-m-orthogonalite-05",
      "bo-m-orthogonalite-16"
    ],
    "prerequis": [
      "n-vecteurs-espace-combinaisons",
      "n-vecteurs-espace-plans",
      "1e:produit-scalaire"
    ],
    "attendusBac": [
      "Calculer le produit scalaire $\\overrightarrow{\\text{AR}} \\cdot \\overrightarrow{\\text{AT}}$."
    ]
  },
  {
    "id": "n-orthogonalite-espace-repere-orthonorme",
    "chapitre": "orthogonalite-espace",
    "titre": "Vecteurs orthogonaux, calculs en repère orthonormé",
    "resume": "Montrer que deux vecteurs sont orthogonaux avec $xx' + yy' + zz' = 0$, puis calculer une longueur ou un angle dans un repère orthonormé.",
    "ordre": 20,
    "priorite": 3,
    "priorisation": "annales",
    "pourquoi": "Tombé dans 98 sujets sur 103 depuis 2021.",
    "capacites": [
      "bo-m-orthogonalite-02",
      "bo-m-orthogonalite-03",
      "bo-m-orthogonalite-04",
      "bo-m-orthogonalite-09"
    ],
    "prerequis": [
      "n-orthogonalite-espace-produit-scalaire",
      "n-vecteurs-espace-bases-reperes",
      "1e:geometrie-reperee"
    ],
    "attendusBac": [
      "Calculer le produit scalaire $\\overrightarrow{\\text{MN}} \\cdot \\overrightarrow{\\text{MP}}$, puis en déduire la nature du triangle MNP.",
      "À l'aide du produit scalaire $\\overrightarrow{\\text{AB}}\\cdot \\overrightarrow{\\text{AC}}$, déterminer la valeur du cosinus de l'angle $\\widehat{\\text{BAC}}$ puis donner une valeur approchée de la mesure de l'angle $\\widehat{\\text{BAC}}$ au dixième de degré.",
      "Quelle est la nature du triangle EGD ? Justifier la réponse."
    ]
  },
  {
    "id": "n-orthogonalite-espace-vecteur-normal",
    "chapitre": "orthogonalite-espace",
    "titre": "Droites et plans orthogonaux, vecteur normal",
    "resume": "Prouver qu'un vecteur est normal au plan $(ABC)$, ou qu'une droite est orthogonale à un plan, en vérifiant deux produits scalaires nuls.",
    "ordre": 30,
    "priorite": 3,
    "priorisation": "annales",
    "pourquoi": "Tombé dans 94 sujets sur 103 depuis 2021.",
    "capacites": [
      "bo-m-orthogonalite-06",
      "bo-m-orthogonalite-07",
      "bo-m-orthogonalite-12",
      "bo-m-orthogonalite-15"
    ],
    "prerequis": [
      "n-orthogonalite-espace-repere-orthonorme",
      "n-vecteurs-espace-plans",
      "n-vecteurs-espace-positions-relatives"
    ],
    "attendusBac": [
      "Démontrer que le vecteur $\\vec{n}(2\\,;\\,1\\,;\\,2)$ est un vecteur normal au plan (ABC).",
      "Démontrer que la droite (EC) est orthogonale au plan (GBD).",
      "Montrer que la droite (BD) est une hauteur de la pyramide ABCD."
    ]
  },
  {
    "id": "n-orthogonalite-espace-projete-distance",
    "chapitre": "orthogonalite-espace",
    "titre": "Projeté orthogonal, distance à un plan ou à une droite",
    "resume": "Reconnaître le projeté orthogonal $H$ d'un point $M$ sur un plan ou une droite, et s'en servir : la distance de $M$ au plan, ou à la droite, est $MH$.",
    "ordre": 40,
    "priorite": 3,
    "priorisation": "annales",
    "pourquoi": "Tombé dans 71 sujets sur 103 depuis 2021.",
    "capacites": [
      "bo-m-orthogonalite-08",
      "bo-m-orthogonalite-10",
      "bo-m-orthogonalite-13",
      "bo-m-orthogonalite-14"
    ],
    "prerequis": [
      "n-orthogonalite-espace-vecteur-normal",
      "n-orthogonalite-espace-repere-orthonorme",
      "n-vecteurs-espace-configurations"
    ],
    "attendusBac": [
      "Démontrer que le point H est le projeté orthogonal de B sur le plan (CAD).",
      "Montrer que H est le projeté orthogonal de A sur $(d)$.",
      "Déterminer la distance du point D au plan (ABC)."
    ]
  },
  {
    "id": "n-orthogonalite-espace-mesures",
    "chapitre": "orthogonalite-espace",
    "titre": "Longueurs, angles, aires et volumes",
    "resume": "Calculer le volume d'un tétraèdre ou d'une pyramide (aire de la base × hauteur ÷ 3), et retourner le calcul pour trouver une aire ou une distance.",
    "ordre": 50,
    "priorite": 3,
    "priorisation": "annales",
    "pourquoi": "Tombé dans 55 sujets sur 103 depuis 2021.",
    "capacites": [
      "bo-m-orthogonalite-11"
    ],
    "prerequis": [
      "n-orthogonalite-espace-projete-distance",
      "n-orthogonalite-espace-repere-orthonorme"
    ],
    "attendusBac": [
      "En calculant de deux façons différentes le volume de la pyramide OABC, déterminer l'aire du triangle ABC.",
      "Calculer le volume du tétraèdre SABC.",
      "Calculer, en unité d'aire, l'aire du triangle ABC."
    ]
  }
]
