[
  {
    "id": "n-integration-aire",
    "chapitre": "integration",
    "titre": "Intégrale d'une fonction positive : une aire",
    "resume": "Lire $\\int_a^b f(x)\\,\\mathrm{d}x$ comme l'aire sous la courbe d'une fonction positive, et l'estimer en comptant des carreaux ou avec des rectangles.",
    "ordre": 10,
    "priorite": 3,
    "priorisation": "annales",
    "pourquoi": "Tombé dans 23 sujets sur 51 depuis 2021 ; monte d'un cran car le calcul par une primitive, incontournable, repose sur la définition de l'intégrale comme aire.",
    "capacites": [
      "bo-m-integrale-01",
      "bo-m-integrale-09",
      "bo-m-integrale-19",
      "bo-m-integrale-20",
      "bo-m-integrale-17"
    ],
    "prerequis": [
      "n-continuite-fonction-continue"
    ],
    "attendusBac": [
      "Déterminer l'aire $\\mathcal{A}(\\alpha)$, exprimée en unité d'aire, du domaine du plan délimité par l'axe des abscisses, la courbe $\\mathcal{C}_{f}$ et les droites d'équation $x=0$ et $x=\\alpha$.",
      "Donner une interprétation graphique de $I_n$."
    ]
  },
  {
    "id": "n-integration-primitive",
    "chapitre": "integration",
    "titre": "Calculer une intégrale avec une primitive",
    "resume": "Calculer $\\int_a^b f(x)\\,\\mathrm{d}x = F(b) - F(a)$ avec une primitive $F$ de $f$, que $f$ soit positive ou non : $\\int_1^{e} \\frac{1}{x}\\,\\mathrm{d}x = 1$.",
    "ordre": 20,
    "priorite": 3,
    "priorisation": "annales",
    "pourquoi": "Tombé dans 43 sujets sur 51 depuis 2021.",
    "capacites": [
      "bo-m-integrale-02",
      "bo-m-integrale-03",
      "bo-m-integrale-04",
      "bo-m-integrale-05",
      "bo-m-integrale-10",
      "bo-m-integrale-15"
    ],
    "prerequis": [
      "n-integration-aire",
      "n-primitives-equations-differentielles-primitive",
      "n-primitives-equations-differentielles-calcul"
    ],
    "attendusBac": [
      "Montrer que : $\\displaystyle\\int_{0}^{2} \\dfrac{\\ln (x+1)}{x+1} \\,\\mathrm{d} x=\\dfrac{1}{2}\\big(\\ln 3\\big)^{2}$.",
      "On considère la fonction $g$ définie sur $\\mathbb{R}$ par $g(x) = x^2 \\ln (x^2 + 4)$. Alors $\\displaystyle\\int_0^2 g'(x)\\,\\mathrm{d}x$ vaut, à $10^{-1}$ près :"
    ]
  },
  {
    "id": "n-integration-proprietes",
    "chapitre": "integration",
    "titre": "Linéarité, Chasles, positivité : encadrer une intégrale",
    "resume": "Couper une intégrale en morceaux, et l'encadrer sans la calculer à partir d'un encadrement de la fonction : $\\int_0^1 e^{-x^2}\\,\\mathrm{d}x \\leqslant 1$.",
    "ordre": 30,
    "priorite": 2,
    "priorisation": "annales",
    "pourquoi": "Tombé dans 14 sujets sur 51 depuis 2021. Pas relevée malgré la correction « prérequis » (l'intégration par parties en dépend) : les incontournables doivent rester au plus la moitié des notions.",
    "capacites": [
      "bo-m-integrale-06",
      "bo-m-integrale-11"
    ],
    "prerequis": [
      "n-integration-primitive"
    ],
    "attendusBac": [
      "On admet dans cette question que, pour tout nombre réel $x \\in [2\\,;\\,4]$, on a l'encadrement : $0{,}5x -1 \\leqslant f(x) \\leqslant 0{,}25x + 0{,}25$. En déduire l'encadrement : $1 \\leqslant I \\leqslant 2$."
    ]
  },
  {
    "id": "n-integration-courbes-valeur-moyenne",
    "chapitre": "integration",
    "titre": "Aire entre deux courbes, valeur moyenne",
    "resume": "Calculer l'aire entre deux courbes, $\\int_a^b (f(x) - g(x))\\,\\mathrm{d}x$ si $f \\geqslant g$, et une valeur moyenne, comme une température moyenne.",
    "ordre": 40,
    "priorite": 2,
    "priorisation": "annales",
    "pourquoi": "Tombé dans 16 sujets sur 51 depuis 2021.",
    "capacites": [
      "bo-m-integrale-07",
      "bo-m-integrale-12",
      "bo-m-integrale-14"
    ],
    "prerequis": [
      "n-integration-primitive",
      "n-integration-proprietes"
    ],
    "attendusBac": [
      "Calculer la valeur exacte de l'aire du domaine hachuré situé entre les courbes $\\mathcal{C}_f$ et $\\mathcal{C}_g$ et les droites d'équation $x = 0$ et $x = \\dfrac{\\pi}{2}$.",
      "À l'aide d'une intégrale, calculer la valeur moyenne de la température sur les $100$ premières secondes.",
      "Calculer la glycémie moyenne en g.L$^{-1}$ chez cette personne lors des six heures qui suivent le repas."
    ]
  },
  {
    "id": "n-integration-parties",
    "chapitre": "integration",
    "titre": "Intégration par parties",
    "resume": "Calculer une intégrale comme $\\int_0^1 x e^x\\,\\mathrm{d}x$ en dérivant un facteur et en prenant une primitive de l'autre (intégration par parties).",
    "ordre": 50,
    "priorite": 3,
    "priorisation": "annales",
    "pourquoi": "Tombé dans 28 sujets sur 51 depuis 2021.",
    "capacites": [
      "bo-m-integrale-08",
      "bo-m-integrale-16"
    ],
    "prerequis": [
      "n-integration-primitive",
      "n-integration-proprietes",
      "1e:derivation"
    ],
    "attendusBac": [
      "À l'aide d'une intégration par parties, montrer que $\\displaystyle\\int_1^{\\text{e}} x\\ln x\\, \\text{d}x = \\dfrac{\\text{e}^2 + 1}{4}$.",
      "On note $\\mathcal{A}$ l'aire du domaine délimité par la courbe $\\mathcal{C}$, l'axe des abscisses et les droites d'équation $x=1$ et $x=2$. En vous aidant d'une intégration par parties, déterminer la valeur exacte de l'aire $\\mathcal{A}$ en unité d'aire."
    ]
  },
  {
    "id": "n-integration-suites",
    "chapitre": "integration",
    "titre": "Suites d'intégrales",
    "resume": "Étudier une suite comme $I_n = \\int_0^1 x^n e^{-x}\\,\\mathrm{d}x$ : variations, limite, et lien entre $I_{n+1}$ et $I_n$ par une intégration par parties.",
    "ordre": 60,
    "priorite": 1,
    "priorisation": "annales",
    "pourquoi": "Tombé dans 7 sujets sur 51 depuis 2021.",
    "capacites": [
      "bo-m-integrale-13",
      "bo-m-integrale-21",
      "bo-m-integrale-18"
    ],
    "prerequis": [
      "n-integration-proprietes",
      "n-integration-parties",
      "n-limites-suites-monotone-bornee",
      "n-limites-suites-comparaison"
    ],
    "attendusBac": [
      "On considère la suite $(I_n)$ définie pour tout entier naturel $n$ par $I_n = \\displaystyle\\int_{-2}^0 x^n\\text{e}^{-x}\\,\\mathrm{d}x$. En utilisant une intégration par partie, démontrer l'égalité : $I_{n+1} = (- 2)^{n+1} \\text{e}^2 + (n + 1)I_n$.",
      "Montrer que, pour tout entier naturel $n$, on a $I_{n+1} - I_n \\leqslant 0$.",
      "Démontrer que la suite $(I_n)$ est convergente, vers une limite positive ou nulle que l'on notera $\\ell$."
    ]
  }
]
