[
  {
    "id": "n-loi-binomiale-epreuves-independantes",
    "chapitre": "loi-binomiale",
    "titre": "Épreuves indépendantes, arbres pondérés",
    "resume": "Représenter des épreuves successives par un arbre, multiplier le long d'un chemin, et calculer une probabilité avec la formule des probabilités totales.",
    "ordre": 10,
    "priorite": 2,
    "priorisation": "estimation",
    "pourquoi": "Estimé : l'arbre pondéré et les probabilités totales ouvrent souvent l'exercice de probabilités ; c'est en partie un rappel de première.",
    "capacites": [
      "bo-m-bernoulli-01",
      "bo-m-bernoulli-05"
    ],
    "prerequis": [
      "n-denombrement-principes",
      "1e:probas-cond"
    ],
    "attendusBac": [
      "Traduire la situation à l'aide d'un arbre pondéré.",
      "Démontrer que la probabilité que le test de la personne choisie au hasard soit positif, est de $0{,}0653$.",
      "Calculer la probabilité qu'un individu ayant un test positif soit atteint par le virus."
    ]
  },
  {
    "id": "n-loi-binomiale-schema-bernoulli",
    "chapitre": "loi-binomiale",
    "titre": "Épreuve et schéma de Bernoulli",
    "resume": "Reconnaître une épreuve à deux issues répétée $n$ fois de façon indépendante ; calculer la probabilité de n'avoir que des succès, ou au moins un succès.",
    "ordre": 20,
    "priorite": 2,
    "priorisation": "estimation",
    "pourquoi": "Estimé : rarement demandé pour lui-même, il est la base de la loi binomiale et des calculs « que des succès » ou « au moins un succès ».",
    "capacites": [
      "bo-m-bernoulli-02",
      "bo-m-bernoulli-03",
      "bo-m-bernoulli-12"
    ],
    "prerequis": [
      "n-loi-binomiale-epreuves-independantes",
      "1e:variables-aleatoires"
    ],
    "attendusBac": [
      "On note $p_n$ la probabilité que les $n$ clients soient tous satisfaits de leur achat. Démontrer que $p_n = 0{,}82^n$.",
      "Un joueur fait $n$ parties et on note $p_n$ la probabilité de l'évènement « le joueur gagne au moins une partie ». Montrer que $p_n = 1 - 0{,}6^n$.",
      "Quelle est la probabilité de ne tirer que des pièces défectueuses ?"
    ]
  },
  {
    "id": "n-loi-binomiale-loi-binomiale",
    "chapitre": "loi-binomiale",
    "titre": "Loi binomiale et probabilité de k succès",
    "resume": "Justifier qu'un nombre de succès suit une loi binomiale $\\mathcal{B}(n\\,;\\,p)$ et calculer $P(X = k) = \\binom{n}{k}p^k(1-p)^{n-k}$.",
    "ordre": 30,
    "priorite": 3,
    "priorisation": "estimation",
    "pourquoi": "Estimé : « justifier que X suit une loi binomiale et préciser ses paramètres » est l'une des questions les plus classiques du bac.",
    "capacites": [
      "bo-m-bernoulli-04",
      "bo-m-bernoulli-06",
      "bo-m-bernoulli-09",
      "bo-m-bernoulli-10"
    ],
    "prerequis": [
      "n-loi-binomiale-schema-bernoulli",
      "n-denombrement-combinaisons"
    ],
    "attendusBac": [
      "Justifier que $X$ suit une loi binomiale et préciser les paramètres de cette loi.",
      "Donner l'expression permettant de calculer la probabilité d'avoir, dans un tel échantillon, exactement $10$ paires de verres qui présentent ce défaut.",
      "Dans une urne il y a 6 boules noires et 4 boules rouges. On effectue successivement 10 tirages aléatoires avec remise. Quelle est la probabilité (à $10^{-4}$ près) d'avoir 4 boules noires et 6 boules rouges ?"
    ]
  },
  {
    "id": "n-loi-binomiale-calculatrice",
    "chapitre": "loi-binomiale",
    "titre": "Au plus, au moins : calculer à la calculatrice",
    "resume": "Calculer à la calculatrice la probabilité d'avoir au plus, au moins ou entre $a$ et $b$ succès, et le plus petit $k$ tel que $P(X > k)$ reste sous un seuil.",
    "ordre": 40,
    "priorite": 3,
    "priorisation": "estimation",
    "pourquoi": "Estimé : presque chaque exercice sur la loi binomiale demande une probabilité « au plus » ou « au moins », obtenue à la calculatrice.",
    "capacites": [
      "bo-m-bernoulli-08",
      "bo-m-bernoulli-11",
      "bo-m-bernoulli-14"
    ],
    "prerequis": [
      "n-loi-binomiale-loi-binomiale",
      "n-limites-suites-seuils"
    ],
    "attendusBac": [
      "Déterminer, à $10^{-3}$ près, la probabilité qu'au moins $6$ salariés dans un échantillon de $20$ aient suivi le stage.",
      "Calculer la probabilité qu'il y ait dans l'échantillon au plus $8$ chats présentant un test positif.",
      "Quel est le plus petit entier naturel $k$ tel que la probabilité de tirer au plus $k$ pièces défectueuses soit supérieure ou égale à 95 % ?"
    ]
  },
  {
    "id": "n-loi-binomiale-seuils",
    "chapitre": "loi-binomiale",
    "titre": "Problèmes de seuil, de comparaison, d'optimisation",
    "resume": "Trouver le nombre d'essais pour que la probabilité d'avoir au moins un succès dépasse $0{,}99$, en résolvant $1 - (1-p)^n \\geqslant 0{,}99$ avec $\\ln$.",
    "ordre": 50,
    "priorite": 2,
    "priorisation": "estimation",
    "pourquoi": "Estimé : chercher le nombre d'essais nécessaire revient souvent en fin d'exercice ; ce calcul réutilise les inéquations avec ln.",
    "capacites": [
      "bo-m-bernoulli-07",
      "bo-m-bernoulli-13"
    ],
    "prerequis": [
      "n-loi-binomiale-schema-bernoulli",
      "n-loi-binomiale-loi-binomiale",
      "n-logarithme-equations",
      "n-derivation-convexite-etude-fonction"
    ],
    "attendusBac": [
      "Déterminer le nombre minimum de personnes à tester dans ce pays pour que la probabilité qu'au moins une de ces personnes ait un test positif, soit supérieure à 99 %.",
      "Le directeur de l'entreprise souhaite que la probabilité de n'avoir aucun composant défectueux dans un lot de $n$ composants soit supérieure à $0{,}85$. Il propose de former des lots de 11 composants au maximum. A-t-il raison ? Justifier la réponse.",
      "Par la méthode de votre choix que vous expliciterez, déterminer la plus petite valeur de $n$ telle que $P(X \\geqslant 1) \\geqslant 0{,}99$."
    ]
  }
]
