[
  {
    "id": "n-logarithme-definition",
    "chapitre": "logarithme",
    "titre": "Le logarithme, réciproque de l'exponentielle",
    "resume": "Savoir que $\\ln a$, défini seulement pour $a > 0$, est le nombre dont l'exponentielle vaut $a$, et passer de $e^x = a$ à $x = \\ln a$.",
    "ordre": 10,
    "priorite": 2,
    "priorisation": "annales",
    "pourquoi": "Tombé dans 17 sujets sur 103 depuis 2021 ; sa priorité monte d'un cran car les équations, la dérivée et les limites avec ln reposent sur cette définition.",
    "capacites": [
      "bo-m-logarithme-01"
    ],
    "prerequis": [
      "n-continuite-valeurs-intermediaires",
      "n-limites-fonctions-reference",
      "1e:exponentielle"
    ],
    "attendusBac": [
      "La fonction $x \\longmapsto \\ln \\left(-x^2- x + 6\\right)$ est définie sur"
    ]
  },
  {
    "id": "n-logarithme-proprietes",
    "chapitre": "logarithme",
    "titre": "Propriétés algébriques",
    "resume": "Calculer avec $\\ln(ab) = \\ln a + \\ln b$ et $\\ln(a^n) = n\\ln a$ : écrire $\\ln 12$ avec $\\ln 2$ et $\\ln 3$, simplifier une somme de logarithmes.",
    "ordre": 20,
    "priorite": 2,
    "priorisation": "annales",
    "pourquoi": "Tombé dans 24 sujets sur 103 depuis 2021.",
    "capacites": [
      "bo-m-logarithme-02",
      "bo-m-logarithme-11"
    ],
    "prerequis": [
      "n-logarithme-definition",
      "1e:exponentielle"
    ],
    "attendusBac": [
      "Montrer que, pour tout $x$ appartenant à l'intervalle $]-1\\,;\\,+\\infty[$, on a : $f(x) = \\ln\\left(\\dfrac{\\text{e}^x}{1 + x}\\right)$."
    ]
  },
  {
    "id": "n-logarithme-equations",
    "chapitre": "logarithme",
    "titre": "Équations, inéquations et seuils",
    "resume": "Résoudre une équation ou une inéquation avec $\\ln$ ou $e^x$ en vérifiant où elle a un sens, et trouver le plus petit $n$ tel que $0{,}9^n < 0{,}01$.",
    "ordre": 30,
    "priorite": 3,
    "priorisation": "annales",
    "pourquoi": "Tombé dans 68 sujets sur 103 depuis 2021.",
    "capacites": [
      "bo-m-logarithme-06"
    ],
    "prerequis": [
      "n-logarithme-proprietes",
      "n-limites-suites-seuils",
      "1e:second-degre"
    ],
    "attendusBac": [
      "Déterminer par le calcul le plus petit entier naturel $n$ tel que : $1 - 0{,}72^n \\geqslant 0{,}9$.",
      "En déduire l'ensemble des solutions sur $\\mathbb{R}$ de l'équation : $\\text{e}^{x} - \\text{e}^{\\frac{x}{2}} - 2 = 0$",
      "L'ensemble $S$ des solutions dans $\\mathbb{R}$ de l'inéquation $\\ln (x + 3) < 2\\ln (x + 1)$ est:"
    ]
  },
  {
    "id": "n-logarithme-derivee",
    "chapitre": "logarithme",
    "titre": "Dérivée de ln et de ln(u), variations",
    "resume": "Dériver une fonction qui contient $\\ln$, avec $\\ln'(x) = \\frac{1}{x}$ et $(\\ln u)' = \\frac{u'}{u}$, puis en déduire ses variations.",
    "ordre": 40,
    "priorite": 3,
    "priorisation": "annales",
    "pourquoi": "Tombé dans 73 sujets sur 103 depuis 2021.",
    "capacites": [
      "bo-m-logarithme-03",
      "bo-m-logarithme-08"
    ],
    "prerequis": [
      "n-logarithme-definition",
      "n-derivation-convexite-composee",
      "n-derivation-convexite-etude-fonction"
    ],
    "attendusBac": [
      "On considère la fonction $f$ définie et dérivable sur $]0\\,;\\,+\\infty[$ par : $f(x) = x - \\ln\\left(\\dfrac{x}{4}\\right)$. Étudier les variations de $f$ sur $]0\\,;\\,+\\infty[$ et dresser son tableau de variations.",
      "On considère la fonction $f$ définie sur $[20\\,;\\,+\\infty[$ par $f(x) = \\ln (x) + x \\ln (0{,}95)$. Montrer que $f$ est décroissante sur $[20\\,;\\,+\\infty[$.",
      "On note $h'$ la fonction dérivée de $h$. Démontrer que, pour tout nombre réel $x$ de $]0\\,;\\,+\\infty[$, on a : $h'(x) = \\dfrac{1 - \\ln (x)}{x^2}$."
    ]
  },
  {
    "id": "n-logarithme-limites",
    "chapitre": "logarithme",
    "titre": "Limites, croissances comparées, courbe de ln",
    "resume": "Trouver les limites en $0$ et en $+\\infty$ d'une fonction avec $\\ln$, en sachant que $\\frac{\\ln x}{x}$ tend vers $0$, et tracer la courbe de $\\ln$.",
    "ordre": 50,
    "priorite": 3,
    "priorisation": "annales",
    "pourquoi": "Tombé dans 55 sujets sur 103 depuis 2021.",
    "capacites": [
      "bo-m-logarithme-04",
      "bo-m-logarithme-05",
      "bo-m-logarithme-09",
      "bo-m-logarithme-12"
    ],
    "prerequis": [
      "n-logarithme-derivee",
      "n-limites-fonctions-croissances-comparees",
      "n-limites-fonctions-operations"
    ],
    "attendusBac": [
      "Déterminer les limites de la fonction $f$ en $0$ et en $+\\infty$. En déduire les éventuelles asymptotes à la courbe $\\mathcal{C}_{f}$.",
      "La limite en $+\\infty$ de la fonction $f$ définie sur l'intervalle $]0~;~+\\infty[$ par $f(x) = \\dfrac{2\\ln x}{3x^2 + 1}$ est égale à :",
      "On considère que la fonction $f$ est définie sur $]-2\\,;\\,+\\infty[$ par : $f(x) = x^{2}+ 2x - 1 + \\ln (x + 2)$. Déterminer par le calcul la limite de la fonction $f$ en $-2$. Interpréter graphiquement ce résultat."
    ]
  },
  {
    "id": "n-logarithme-problemes",
    "chapitre": "logarithme",
    "titre": "Résoudre un problème avec ln et exp",
    "resume": "Traduire une question concrète (durée, seuil, maximum) en inéquation ou en étude de fonction avec $\\ln$, et approcher $\\ln a$ par l'algorithme de Briggs.",
    "ordre": 60,
    "priorite": 1,
    "priorisation": "annales",
    "pourquoi": "Tombé dans 12 sujets sur 103 depuis 2021.",
    "capacites": [
      "bo-m-logarithme-07",
      "bo-m-logarithme-10"
    ],
    "prerequis": [
      "n-logarithme-equations",
      "n-logarithme-derivee",
      "n-recurrence-suites-modelisation"
    ],
    "attendusBac": [
      "Selon ce modèle, déterminer au bout de combien de temps le médicament devient réellement efficace.",
      "Déterminer, par le calcul, au bout de combien de jours le nombre de noyaux de polonium sera inférieur à $4{,}5 \\times 10^{21}$. Justifier la réponse.",
      "Existe-t-il une position du point $M$ pour laquelle l'aire du rectangle O$NMP$ est maximale ? Si elle existe, déterminer cette position."
    ]
  }
]
