[
  {
    "id": "n-primitives-equations-differentielles-primitive",
    "chapitre": "primitives-equations-differentielles",
    "titre": "Primitive d'une fonction",
    "resume": "Vérifier que $F$ est une primitive de $f$ en dérivant, savoir que deux primitives diffèrent d'une constante et trouver celle qui vaut $1$ en $0$.",
    "ordre": 10,
    "priorite": 3,
    "priorisation": "annales",
    "pourquoi": "Tombé dans 26 sujets sur 103 depuis 2021 ; monte d'un cran car la résolution de y' = ay, incontournable, repose sur y' = f et sur « deux primitives diffèrent d'une constante ».",
    "capacites": [
      "bo-m-primitives-01",
      "bo-m-primitives-07"
    ],
    "prerequis": [
      "1e:derivation",
      "n-continuite-fonction-continue"
    ],
    "attendusBac": [
      "Vérifier que la fonction $F$ définie par $F(x) =a [x \\ln (x) - x]$ est une primitive de la fonction $f$ sur l'intervalle $]0\\,;\\,+\\infty[$.",
      "On considère une fonction $F$ définie sur $[0\\,;\\,+\\infty[$ par $F(x) = (ax + b)\\text{e}^{-x+1}$, où $a$ et $b$ sont deux nombres réels. Déterminer les valeurs des réels $a$ et $b$ telles que la fonction $F$ soit une primitive de la fonction $f$ sur $[0\\,;\\,+\\infty[$.",
      "On considère une primitive quelconque de la fonction $f$ sur l'intervalle $]0\\,;\\,+\\infty[$. On la note $F$. Peut-on affirmer que la fonction $F$ est strictement décroissante sur l'intervalle $\\left[\\text{e}^{\\frac12}\\,;\\,+\\infty\\right[$ ? Justifier."
    ]
  },
  {
    "id": "n-primitives-equations-differentielles-calcul",
    "chapitre": "primitives-equations-differentielles",
    "titre": "Calculer une primitive",
    "resume": "Trouver une primitive grâce aux primitives de référence et aux formes comme $u'e^u$ ou $\\frac{u'}{u}$ : une primitive de $2x e^{x^2}$ est $e^{x^2}$.",
    "ordre": 20,
    "priorite": 2,
    "priorisation": "annales",
    "pourquoi": "Tombé dans 22 sujets sur 103 depuis 2021.",
    "capacites": [
      "bo-m-primitives-02",
      "bo-m-primitives-04"
    ],
    "prerequis": [
      "n-primitives-equations-differentielles-primitive",
      "n-derivation-convexite-composee",
      "n-logarithme-derivee",
      "n-trigonometrie-derivees-variations"
    ],
    "attendusBac": [
      "Soit $f$ la fonction définie sur $\\mathbb{R}$ par $f(x) = x\\text{e}^{x^2}$. La primitive $F$ de $f$ sur $\\mathbb{R}$ qui vérifie $F(0) = 1$ est définie par :",
      "On considère la fonction $f$ définie sur $]- 1~;~1[$ par $f(x) = \\dfrac{x}{1 - x^2}$. Une primitive de la fonction $f$ est la fonction $g$ définie sur l'intervalle $] - 1~;~1[$ par :",
      "Si $H$ est une primitive d'une fonction $h$ définie et continue sur $\\mathbb{R}$, et si $k$ est la fonction définie sur $\\mathbb{R}$ par $k(x) = h(2x)$, alors, une primitive $K$ de $k$ est définie sur $\\mathbb{R}$ par :"
    ]
  },
  {
    "id": "n-primitives-equations-differentielles-equation-ay",
    "chapitre": "primitives-equations-differentielles",
    "titre": "Équation différentielle y' = ay",
    "resume": "Résoudre $y' = ay$ (solutions $x \\mapsto Ce^{ax}$), trouver la solution qui vaut $y_0$ en $0$ et connaître l'allure des courbes selon le signe de $a$.",
    "ordre": 30,
    "priorite": 3,
    "priorisation": "annales",
    "pourquoi": "Tombé dans 34 sujets sur 63 où y' = ay était au programme, depuis 2021 ; ce compte inclut y' = ay + b, qui se résout à partir de y' = ay.",
    "capacites": [
      "bo-m-primitives-03",
      "bo-m-primitives-08"
    ],
    "prerequis": [
      "n-primitives-equations-differentielles-primitive",
      "1e:exponentielle",
      "n-limites-fonctions-reference"
    ],
    "attendusBac": [
      "Donner toutes les solutions sur $\\mathbb{R}$ de l'équation différentielle $(H)$ : $y' = -y$.",
      "On considère l'équation différentielle $(E) : \\quad 3y' + y = 0$. Résoudre l'équation différentielle $(E)$.",
      "Donner la forme générale des solutions de l'équation différentielle $y' + 0{,}48y = 0$."
    ]
  },
  {
    "id": "n-primitives-equations-differentielles-equation-ay-b",
    "chapitre": "primitives-equations-differentielles",
    "titre": "Équation différentielle y' = ay + b",
    "resume": "Résoudre $y' = ay + b$ grâce à sa solution constante, l'appliquer au refroidissement d'un objet, et approcher une solution pas à pas (méthode d'Euler).",
    "ordre": 40,
    "priorite": 2,
    "priorisation": "annales",
    "pourquoi": "Tombé dans 17 sujets sur 63 où y' = ay + b était au programme, depuis 2021 (le décompte sur 103 sujets mêlait des sessions où elle était hors programme).",
    "capacites": [
      "bo-m-primitives-05",
      "bo-m-primitives-10",
      "bo-m-primitives-09"
    ],
    "prerequis": [
      "n-primitives-equations-differentielles-equation-ay",
      "n-logarithme-equations",
      "n-limites-fonctions-operations"
    ],
    "attendusBac": [
      "Résoudre l'équation différentielle $y' = - y + \\dfrac16$.",
      "La solution $f$ de l'équation différentielle $y'=-3y+7$ telle que $f(0)=1$ est la fonction définie sur $\\mathbb{R}$ par :",
      "On admet que la fonction $f$ est solution de l'équation différentielle $(E)$ : $y'=-0{,}08 y+\\dfrac{q}{50}$, où $q$ est la quantité de chlore, en gramme, rajoutée dans la piscine chaque jour. Justifier que la fonction $f$ est de la forme $f(x)=C \\text{e}^{-0{,}08 x}+\\dfrac{q}{4}$ où $C$ est une constante réelle."
    ]
  },
  {
    "id": "n-primitives-equations-differentielles-equation-ay-f",
    "chapitre": "primitives-equations-differentielles",
    "titre": "Équation différentielle y' = ay + f",
    "resume": "À partir d'une solution particulière $g$ de $y' = ay + f$, vérifiée en dérivant, écrire toutes les solutions : $g$ plus une solution de $y' = ay$.",
    "ordre": 50,
    "priorite": 2,
    "priorisation": "annales",
    "pourquoi": "Tombé dans 22 sujets sur 103 depuis 2021.",
    "capacites": [
      "bo-m-primitives-06"
    ],
    "prerequis": [
      "n-primitives-equations-differentielles-equation-ay-b",
      "n-derivation-convexite-composee",
      "n-trigonometrie-derivees-variations"
    ],
    "attendusBac": [
      "On considère l'équation différentielle $(E) : \\quad y' +\\dfrac14y = 20\\text{e}^{-\\frac14 x}$, d'inconnue $y$, fonction définie et dérivable sur l'intervalle $[0\\,;\\,+\\infty[$. Déterminer la valeur du réel $a$ tel que la fonction $g$ définie sur l'intervalle $[0\\,;\\,+\\infty[$ par $g(x) = ax\\text{e}^{-\\frac14 x}$ soit une solution particulière de l'équation différentielle $(E)$.",
      "Démontrer que : « $f$ est solution de $(E)$ » est équivalent à « $f - h$ est solution de $(E_0)$ ».",
      "À l'aide de la résolution de l'équation différentielle $y' = y$, résoudre l'équation différentielle $(E)$."
    ]
  }
]
