[
  {
    "id": "n-derivation-convexite-composee",
    "chapitre": "derivation-convexite",
    "titre": "Dérivée d'une fonction composée",
    "resume": "Dériver une fonction obtenue en enchaînant deux fonctions, comme $e^{-x^2}$ ou $\\sqrt{x^2+1}$, avec la règle $(v \\circ u)' = (v' \\circ u) \\times u'$.",
    "ordre": 10,
    "priorite": 2,
    "priorisation": "annales",
    "pourquoi": "Tombé dans 50 sujets sur 103 depuis 2021.",
    "capacites": [
      "bo-m-derivation-01",
      "bo-m-derivation-05"
    ],
    "prerequis": [
      "n-limites-fonctions-operations",
      "1e:derivation",
      "1e:exponentielle"
    ],
    "attendusBac": [
      "Montrer que, pour tout nombre réel $t$, $h'(t) = \\dfrac{f(t)}{\\sqrt{t^2 + \\text{e}^{-2t}}}$."
    ]
  },
  {
    "id": "n-derivation-convexite-etude-fonction",
    "chapitre": "derivation-convexite",
    "titre": "Étude complète d'une fonction",
    "resume": "Mener l'étude complète d'une fonction : calculer sa dérivée, trouver son signe, dresser le tableau de variations avec les limites aux bornes.",
    "ordre": 20,
    "priorite": 3,
    "priorisation": "annales",
    "pourquoi": "Tombé dans 79 sujets sur 103 depuis 2021.",
    "capacites": [
      "bo-m-derivation-06"
    ],
    "prerequis": [
      "n-derivation-convexite-composee",
      "n-limites-fonctions-croissances-comparees",
      "1e:derivation"
    ],
    "attendusBac": [
      "Déterminer les variations de la fonction $f$ sur l'intervalle $]0\\,;\\,+\\infty[$. On établira un tableau de variations de la fonction $f$ dans lequel apparaîtront les limites.",
      "Démontrer que, pour tout réel $x$ appartenant à $[0~;~+\\infty[$ on a : $g'(x) = (- 0{,}03x + 0{,}29)\\text{e}^{0{,}2x}$.",
      "En déduire la quantité de jus de fruits, au litre près, que l'entreprise doit vendre afin de réaliser un bénéfice maximal."
    ]
  },
  {
    "id": "n-derivation-convexite-derivee-seconde",
    "chapitre": "derivation-convexite",
    "titre": "Dérivée seconde",
    "resume": "Calculer $f''$, la dérivée de la dérivée, et savoir que son signe donne le sens de variation de $f'$.",
    "ordre": 30,
    "priorite": 3,
    "priorisation": "annales",
    "pourquoi": "Tombé dans 62 sujets sur 103 depuis 2021.",
    "capacites": [
      "bo-m-derivation-02",
      "bo-m-derivation-12"
    ],
    "prerequis": [
      "n-derivation-convexite-composee",
      "1e:derivation"
    ],
    "attendusBac": [
      "On considère la fonction définie sur $\\mathbb{R}$ par $f(x) = x\\text{e}^{-2x}$. On note $f''$ la dérivée seconde de la fonction $f$. Quel que soit le réel $x$, $f''(x)$ est égal à :",
      "Montrer que pour tout $x$ appartenant à l'intervalle $]0\\,;\\,+\\infty[$, $f''(x) = \\dfrac{2(x + 1)(x - 1)}{x^3}$.",
      "Associer chacune des fonctions $f$, $f'$ et $f''$ à sa courbe représentative."
    ]
  },
  {
    "id": "n-derivation-convexite-convexe",
    "chapitre": "derivation-convexite",
    "titre": "Fonction convexe, fonction concave",
    "resume": "Savoir où une fonction est convexe (courbe en bol, sous ses cordes) ou concave (en dôme), grâce au signe de $f''$.",
    "ordre": 40,
    "priorite": 3,
    "priorisation": "annales",
    "pourquoi": "Tombé dans 70 sujets sur 103 depuis 2021.",
    "capacites": [
      "bo-m-derivation-03"
    ],
    "prerequis": [
      "n-derivation-convexite-derivee-seconde",
      "1e:derivation"
    ],
    "attendusBac": [
      "Déterminer, pour tout nombre réel $x$, l'expression de $f''(x)$ et étudier la convexité de la fonction $f$.",
      "Justifier que la fonction $f$ est convexe sur l'intervalle $]0~;~+\\infty[$.",
      "Déterminer le plus grand intervalle sur lequel la fonction $u$ est concave."
    ]
  },
  {
    "id": "n-derivation-convexite-tangentes-inegalites",
    "chapitre": "derivation-convexite",
    "titre": "Convexité et tangentes : prouver une inégalité",
    "resume": "Démontrer une inégalité comme $e^x \\geqslant 1 + x$ en utilisant qu'une courbe convexe reste au-dessus de ses tangentes.",
    "ordre": 50,
    "priorite": 2,
    "priorisation": "annales",
    "pourquoi": "Tombé dans 13 sujets sur 103 depuis 2021 ; monte d'un cran car le point d'inflexion, où la courbe traverse sa tangente, s'appuie sur la position par rapport aux tangentes.",
    "capacites": [
      "bo-m-derivation-07",
      "bo-m-derivation-10",
      "bo-m-derivation-11",
      "bo-m-derivation-13"
    ],
    "prerequis": [
      "n-derivation-convexite-etude-fonction",
      "n-derivation-convexite-convexe",
      "1e:derivation"
    ],
    "attendusBac": [
      "En déduire la position relative de la tangente $\\mathcal{T}$ et de la courbe $\\mathcal{C}_f$.",
      "Montrer que la courbe $\\mathcal{C}_f$ est au-dessus de la tangente $T_{\\text{B}}$ sur l'intervalle $]1\\,;\\, +\\infty[$.",
      "Montrer que, pour tout $x$ appartenant à l'intervalle $[-1\\,;\\,2]$, on a $f(x) \\leqslant x + 6$."
    ]
  },
  {
    "id": "n-derivation-convexite-inflexion",
    "chapitre": "derivation-convexite",
    "titre": "Point d'inflexion, lecture graphique",
    "resume": "Trouver où la courbe change de convexité (point d'inflexion), et lire la convexité sur la courbe ou le tableau de $f$, $f'$ ou $f''$.",
    "ordre": 60,
    "priorite": 3,
    "priorisation": "annales",
    "pourquoi": "Tombé dans 65 sujets sur 103 depuis 2021.",
    "capacites": [
      "bo-m-derivation-04",
      "bo-m-derivation-08",
      "bo-m-derivation-09"
    ],
    "prerequis": [
      "n-derivation-convexite-convexe",
      "n-derivation-convexite-tangentes-inegalites"
    ],
    "attendusBac": [
      "Montrer que $\\mathcal{C}_{f}$ admet un unique point d'inflexion et déterminer son abscisse.",
      "Étudier la convexité de $f$ et préciser les coordonnées du point d'inflexion de $\\mathcal{C}_f$.",
      "Donner les intervalles sur lesquels la fonction $f$ semble convexe ou concave. Que semble représenter le point A pour la courbe $(\\mathcal{C}_f)$ ?"
    ]
  }
]
