[
  {
    "id": "n-trigonometrie-derivees-variations",
    "chapitre": "trigonometrie",
    "titre": "Dérivées, variations et courbes de sinus et cosinus",
    "resume": "Dériver $\\sin$ et $\\cos$ ($\\sin' = \\cos$, $\\cos' = -\\sin$), en déduire leurs variations et leurs courbes, et trouver la limite de $\\frac{\\sin x}{x}$ en $0$.",
    "ordre": 10,
    "priorite": 1,
    "priorisation": "annales",
    "pourquoi": "Tombé dans 9 sujets sur 51 depuis 2021.",
    "capacites": [
      "bo-m-trigonometrie-01"
    ],
    "prerequis": [
      "1e:trigonometrie",
      "1e:derivation",
      "n-derivation-convexite-composee"
    ],
    "attendusBac": [
      "Déterminer la limite de $f$ en 0. On pourra utiliser le taux d'accroissement de la fonction sinus en 0."
    ]
  },
  {
    "id": "n-trigonometrie-equations-inequations",
    "chapitre": "trigonometrie",
    "titre": "Équations et inéquations trigonométriques",
    "resume": "Résoudre $\\cos(x) = a$, $\\sin(x) = a$ ou $\\cos(x) \\leqslant a$ sur $[-\\pi\\,;\\,\\pi]$ en lisant les solutions sur le cercle trigonométrique.",
    "ordre": 20,
    "priorite": 1,
    "priorisation": "annales",
    "pourquoi": "Tombé dans 0 sujet sur 51 depuis 2021.",
    "capacites": [
      "bo-m-trigonometrie-02"
    ],
    "prerequis": [
      "1e:trigonometrie"
    ],
    "attendusBac": []
  },
  {
    "id": "n-trigonometrie-etude-fonction",
    "chapitre": "trigonometrie",
    "titre": "Étudier une fonction trigonométrique dans un problème",
    "resume": "Étudier une fonction construite avec $\\sin$ et $\\cos$ (dérivée, signe, variations) pour répondre à un problème, comme trouver l'aire maximale d'une figure.",
    "ordre": 30,
    "priorite": 1,
    "priorisation": "annales",
    "pourquoi": "Tombé dans 3 sujets sur 51 depuis 2021.",
    "capacites": [
      "bo-m-trigonometrie-03",
      "bo-m-trigonometrie-04"
    ],
    "prerequis": [
      "n-trigonometrie-derivees-variations",
      "n-trigonometrie-equations-inequations",
      "n-derivation-convexite-etude-fonction"
    ],
    "attendusBac": [
      "Montrer que pour tout réel $x$ de l'intervalle $[0 ; 2 \\pi]$, on a : $g'(x)=-x \\sin (x)$"
    ]
  }
]
