[
  {
    "id": "n-temoin-methodes-maths-logique",
    "chapitre": "temoin-methodes-maths",
    "titre": "Logique (essai)",
    "resume": "Résumé d'essai de la notion de logique.",
    "ordre": 10,
    "priorite": 1,
    "priorisation": "estimation",
    "pourquoi": "Estimation d'essai.",
    "capacites": [
      "bo-m-temoin-methodes-01"
    ],
    "prerequis": [],
    "attendusBac": []
  },
  {
    "id": "n-temoin-methodes-maths-python",
    "chapitre": "temoin-methodes-maths",
    "titre": "Python (essai)",
    "resume": "Résumé d'essai de la notion de Python.",
    "ordre": 20,
    "priorite": 1,
    "priorisation": "estimation",
    "pourquoi": "Estimation d'essai.",
    "capacites": [
      "bo-m-temoin-methodes-02"
    ],
    "prerequis": [],
    "attendusBac": []
  },
  {
    "id": "n-temoin-methodes-maths-redaction",
    "chapitre": "temoin-methodes-maths",
    "titre": "Rédaction (essai)",
    "resume": "Résumé d'essai de la notion de rédaction.",
    "ordre": 30,
    "priorite": 1,
    "priorisation": "estimation",
    "pourquoi": "Estimation d'essai.",
    "capacites": [
      "bo-m-temoin-methodes-03"
    ],
    "prerequis": [],
    "attendusBac": []
  }
]
