[
  {
    "id": "n-temoin-physique-chimie-alpha",
    "chapitre": "temoin-physique-chimie",
    "titre": "Notion d'essai fréquente",
    "resume": "Résumé d'essai de la première notion de physique-chimie.",
    "ordre": 10,
    "priorite": 2,
    "priorisation": "estimation",
    "pourquoi": "Estimation d'essai.",
    "capacites": [
      "bo-pc-temoin-01"
    ],
    "prerequis": [],
    "attendusBac": []
  },
  {
    "id": "n-temoin-physique-chimie-beta",
    "chapitre": "temoin-physique-chimie",
    "titre": "Notion d'essai expérimentale",
    "resume": "Résumé d'essai de la notion expérimentale.",
    "ordre": 20,
    "priorite": 1,
    "priorisation": "estimation",
    "pourquoi": "Estimation d'essai.",
    "capacites": [
      "bo-pc-temoin-02"
    ],
    "prerequis": [
      "n-temoin-physique-chimie-alpha"
    ],
    "attendusBac": []
  },
  {
    "id": "n-temoin-physique-chimie-gamma",
    "chapitre": "temoin-physique-chimie",
    "titre": "Notion d'essai numérique",
    "resume": "Résumé d'essai de la notion numérique.",
    "ordre": 30,
    "priorite": 1,
    "priorisation": "estimation",
    "pourquoi": "Estimation d'essai.",
    "capacites": [
      "bo-pc-temoin-03",
      "bo-pc-temoin-04"
    ],
    "prerequis": [
      "n-temoin-physique-chimie-beta"
    ],
    "attendusBac": []
  }
]
