[
  {
    "id": "n-acides-bases-reaction",
    "chapitre": "acides-bases",
    "titre": "Acide, base, couple et réaction acide-base",
    "resume": "Repérer l'acide qui cède un ion $\\mathrm{H^+}$ et la base qui le capte, écrire les deux couples en jeu, puis l'équation de la réaction acide-base.",
    "ordre": 10,
    "priorite": 3,
    "priorisation": "estimation",
    "pourquoi": "Estimé : souvent demandé, et indispensable pour les titrages acide-base, incontournables au bac.",
    "capacites": [
      "bo-pc-acide-base-01",
      "bo-pc-acide-base-04"
    ],
    "prerequis": [],
    "attendusBac": []
  },
  {
    "id": "n-acides-bases-couples-usuels",
    "chapitre": "acides-bases",
    "titre": "Couples usuels : eau, acide carbonique, acides carboxyliques, amines",
    "resume": "Écrire les couples à connaître (eau, acide carbonique, acides carboxyliques, amines) et en dessiner les espèces : schéma de Lewis, formule semi-développée.",
    "ordre": 20,
    "priorite": 2,
    "priorisation": "estimation",
    "pourquoi": "Estimé : les acides carboxyliques et les amines reviennent souvent dans les sujets ; leur schéma de Lewis ou leur formule semi-développée y est parfois demandé.",
    "capacites": [
      "bo-pc-acide-base-02",
      "bo-pc-acide-base-05"
    ],
    "prerequis": [
      "n-acides-bases-reaction"
    ],
    "attendusBac": []
  },
  {
    "id": "n-acides-bases-amphotere",
    "chapitre": "acides-bases",
    "titre": "Espèce amphotère",
    "resume": "Justifier qu'une espèce est amphotère : acide d'un couple et base d'un autre, comme l'eau ou l'ion hydrogénocarbonate $\\mathrm{HCO_3^-}$.",
    "ordre": 30,
    "priorite": 2,
    "priorisation": "estimation",
    "pourquoi": "Estimé : rarement demandé seul, mais indispensable pour comprendre la réaction de l'eau sur elle-même, vue avec la force des acides et des bases.",
    "capacites": [
      "bo-pc-acide-base-03",
      "bo-pc-acide-base-06"
    ],
    "prerequis": [
      "n-acides-bases-reaction",
      "n-acides-bases-couples-usuels"
    ],
    "attendusBac": []
  },
  {
    "id": "n-acides-bases-ph",
    "chapitre": "acides-bases",
    "titre": "pH et concentration en ion oxonium",
    "resume": "Calculer un pH à partir de la concentration en ion oxonium, et l'inverse ; vérifier la relation en mesurant le pH de solutions diluées par 10.",
    "ordre": 40,
    "priorite": 3,
    "priorisation": "estimation",
    "pourquoi": "Estimé : passer de la concentration en ion oxonium au pH, ou l'inverse, revient dans presque tous les exercices sur les acides et les bases, titrages compris.",
    "capacites": [
      "bo-pc-methodes-physiques-01",
      "bo-pc-methodes-physiques-02",
      "bo-pc-methodes-physiques-03"
    ],
    "prerequis": [
      "n-acides-bases-couples-usuels"
    ],
    "attendusBac": []
  }
]
